<?xml version="1.0" encoding="utf-8"?>
<!DOCTYPE gui SYSTEM "layout.dtd">
<gui>
	<panel layout="border">
		<splitpane drawcontinuous="true" resizeweight=".7" split="horizontal">
			<panel layout="border">
				<center>
					<panel layout="box" orientation="page">
						<component type="timerDisplay"/>
						<component type="scrambleArea"/>
					</panel>
				</center>
				<south>
					<panel layout="box" orientation="page">
						<scrollpane verticalpolicy="never" horizontalpolicy="asneeded">
							<panel alignmentY=".5" layout="flow" hgap="5" vgap="5">
								<component type="stackmatStatusLabel"/>
								<component type="scrambleChooser"/>
								<component type="scrambleLength"/>
								<component type="scrambleNumber"/>
								<component type="scrambleAttributes"/>
							</panel>
						</scrollpane>
						<panel layout="border">
							<line_start><button action="submitSundayContest">%%submitsunday%%</button></line_start>
							<center><panel><checkbox alignmentX=".5" action="keyboardTiming">%%usekeyboard%%</checkbox></panel></center>
							<line_end>
								<panel>
									<button action="newSession">%%newsession%%</button>
									<button action="reset">%%clearsession%%</button>
								</panel>
							</line_end>
						</panel>
						<panel layout="box" orientation="line">
							<panel border="%%seshstats%%" layout="grid" cols="1">
								<panel layout="box" orientation="line">
									<label>%%raof%% $$RASize0$$</label>
									<button action="currentAverage0"><![CDATA[<html><font color="$$configuration_Statistics_Color_currentAverage$$">%%currave%% $$currentAverage0$$ $$progressAverageParens0$$</font></html>]]></button>
									<button action="bestAverage0"><![CDATA[<html><font color="$$configuration_Statistics_Color_bestRA$$">%%bestra%% $$bestRA0$$</font></html>]]></button>
								</panel>
								<panel layout="box" orientation="line">
									<label>%%raof%% $$RASize1$$</label>
									<button action="currentAverage1"><![CDATA[<html><font color="$$configuration_Statistics_Color_currentAverage$$">%%currave%% $$currentAverage1$$ $$progressAverageParens1$$</font></font></html>]]></button>
									<button action="bestAverage1"><![CDATA[<html><font color="$$configuration_Statistics_Color_bestRA$$">%%bestra%% $$bestRA1$$</font></html>]]></button>
								</panel>
								<panel layout="box" orientation="line">
									<label>$$solves$$/$$attempts$$ (%%solves%%/%%attempts%%)</label>
									<button action="sessionAverage"><![CDATA[<html>%%seshave%% $$sessionAverage$$ $$progressSessionAverageParens$$</html>]]></button>
								</panel>
							</panel>
							<panel border="%%history%%" layout="box" orientation="page">
								<panel><label alignmentX=".5">%%bestever%% $$veryBestTime$$</label></panel>
								<panel><label alignmentX=".5">%%bestraof%% $$RASize0$$: $$veryBestRA0$$</label></panel>
								<panel><label alignmentX=".5">$$globalSolveCount$$/$$globalAttemptCount$$ %%globalaverage%% $$globalAverage$$</label></panel>
							</panel>
						</panel>
					</panel>
				</south>
			</panel>
			<panel nominsize="false" layout="border">
				<tabbedpane>
					<component name="%%times%%" type="timesList"/>
					<component name="%%sessions%%" type="sessionsList"/>
				</tabbedpane>
			</panel>
		</splitpane>
	</panel>
	<menubar>
		<menu mnemonic="f">%%file%%
			<menuitem action="importScrambles">%%import%%</menuitem>
			<menuitem action="exportScrambles">%%export%%</menuitem>
			<separator/>
			<menuitem action="addTime">%%addtime%%</menuitem>
			<separator/>
			<menuitem action="connectToServer">%%connect%%</menuitem>
			<separator/>
			<menuitem action="showConfiguration">%%configuration%%</menuitem>
			<separator/>
			<menuitem action="exit">%%exit%%</menuitem>
		</menu>
		<menu mnemonic="o">%%options%%
			<menuitem action="undo"/>
			<menuitem action="redo"/>
			<separator/>
			<checkboxmenuitem action="toggleScramblePopup">%%togglescramblepopup%%</checkboxmenuitem>
			<menu mnemonic="k">%%keyboardtimer%%
				<checkboxmenuitem action="toggleLessAnnoyingDisplay">%%lessannoying%%</checkboxmenuitem>
				<checkboxmenuitem action="toggleHideScrambles">%%hidescrambles%%</checkboxmenuitem>
				<checkboxmenuitem action="toggleSpacebarStartsTimer">%%spacebaronly%%</checkboxmenuitem>
				<checkboxmenuitem action="toggleFullscreenTiming">%%fullscreentiming%%</checkboxmenuitem>
			</menu>
			<component type="customGUIMenu"/>
		</menu>
		<glue orientation="horizontal"/>
		<button nominsize="true" action="undo"/>
		<button nominsize="true" action="redo"/>
		<component type="languagecombobox"/>
		<component type="profilecombobox"/>
		<glue orientation="horizontal"/>
		<menu mnemonic="h">%%help%%
			<menuitem action="showDocumentation">%%documentation%%</menuitem>
			<menuitem action="showAbout">%%about%%</menuitem>
		</menu>
		<button nominsize="true" action="togglefullscreen">+</button>
	</menubar>
</gui>
